{
  "id": "es-top30-verbs",
  "language": "es",
  "name": "30 most frequent Spanish verbs",
  "description": "The 30 highest-frequency verbs in Spanish based on standard frequency studies. Infinitive form.",
  "items": [
    { "term": "ser",       "translations": { "ru": "быть (постоянно)",         "en": "to be (essential)" } },
    { "term": "estar",     "translations": { "ru": "быть (состояние, место)",  "en": "to be (state, location)" } },
    { "term": "haber",     "translations": { "ru": "иметься (вспом.)",         "en": "to have (auxiliary)" } },
    { "term": "tener",     "translations": { "ru": "иметь",                    "en": "to have" } },
    { "term": "hacer",     "translations": { "ru": "делать",                   "en": "to do, make" } },
    { "term": "ir",        "translations": { "ru": "идти, ехать",              "en": "to go" } },
    { "term": "poder",     "translations": { "ru": "мочь",                     "en": "to be able to" } },
    { "term": "decir",     "translations": { "ru": "сказать, говорить",        "en": "to say, tell" } },
    { "term": "ver",       "translations": { "ru": "видеть",                   "en": "to see" } },
    { "term": "dar",       "translations": { "ru": "давать",                   "en": "to give" } },
    { "term": "saber",     "translations": { "ru": "знать (факты)",            "en": "to know (facts)" } },
    { "term": "querer",    "translations": { "ru": "хотеть, любить",           "en": "to want, love" } },
    { "term": "llegar",    "translations": { "ru": "приходить, прибывать",     "en": "to arrive" } },
    { "term": "pasar",     "translations": { "ru": "проходить, происходить",   "en": "to pass, happen" } },
    { "term": "deber",     "translations": { "ru": "быть должным",             "en": "must, ought to" } },
    { "term": "poner",     "translations": { "ru": "класть, ставить",          "en": "to put, place" } },
    { "term": "parecer",   "translations": { "ru": "казаться",                 "en": "to seem" } },
    { "term": "quedar",    "translations": { "ru": "оставаться",               "en": "to remain, stay" } },
    { "term": "creer",     "translations": { "ru": "верить, считать",          "en": "to believe, think" } },
    { "term": "hablar",    "translations": { "ru": "говорить",                 "en": "to speak, talk" } },
    { "term": "llevar",    "translations": { "ru": "нести, носить",            "en": "to carry, take" } },
    { "term": "dejar",     "translations": { "ru": "оставлять, позволять",     "en": "to leave, let" } },
    { "term": "seguir",    "translations": { "ru": "следовать, продолжать",    "en": "to follow, continue" } },
    { "term": "encontrar", "translations": { "ru": "находить",                 "en": "to find" } },
    { "term": "llamar",    "translations": { "ru": "звать, звонить",           "en": "to call" } },
    { "term": "venir",     "translations": { "ru": "приходить, приезжать",     "en": "to come" } },
    { "term": "pensar",    "translations": { "ru": "думать",                   "en": "to think" } },
    { "term": "salir",     "translations": { "ru": "выходить, уезжать",        "en": "to leave, go out" } },
    { "term": "volver",    "translations": { "ru": "возвращаться",             "en": "to return" } },
    { "term": "tomar",     "translations": { "ru": "брать, пить",              "en": "to take, drink" } }
  ]
}
