{
  "id": "it-top40-words",
  "language": "it",
  "name": "40 most frequent Italian words",
  "description": "40 high-frequency Italian words across common verbs, nouns, adjectives and adverbs, chosen for everyday usefulness rather than raw corpus rank.",
  "items": [
    { "term": "essere",   "translations": { "en": "to be",           "ru": "быть" } },
    { "term": "avere",    "translations": { "en": "to have",         "ru": "иметь" } },
    { "term": "fare",     "translations": { "en": "to do, to make",  "ru": "делать" } },
    { "term": "dire",     "translations": { "en": "to say",          "ru": "говорить, сказать" } },
    { "term": "andare",   "translations": { "en": "to go",           "ru": "идти, ехать" } },
    { "term": "vedere",   "translations": { "en": "to see",          "ru": "видеть" } },
    { "term": "sapere",   "translations": { "en": "to know",         "ru": "знать" } },
    { "term": "potere",   "translations": { "en": "to be able to",   "ru": "мочь" } },
    { "term": "volere",   "translations": { "en": "to want",         "ru": "хотеть" } },
    { "term": "venire",   "translations": { "en": "to come",         "ru": "приходить" } },
    { "term": "dovere",   "translations": { "en": "to have to",      "ru": "быть должным" } },
    { "term": "prendere", "translations": { "en": "to take",         "ru": "брать" } },
    { "term": "trovare",  "translations": { "en": "to find",         "ru": "находить" } },
    { "term": "dare",     "translations": { "en": "to give",         "ru": "давать" } },
    { "term": "parlare",  "translations": { "en": "to speak",        "ru": "говорить" } },
    { "term": "pensare",  "translations": { "en": "to think",        "ru": "думать" } },
    { "term": "tempo",    "translations": { "en": "time, weather",   "ru": "время, погода" } },
    { "term": "giorno",   "translations": { "en": "day",             "ru": "день" } },
    { "term": "uomo",     "translations": { "en": "man",             "ru": "мужчина, человек" } },
    { "term": "donna",    "translations": { "en": "woman",           "ru": "женщина" } },
    { "term": "bambino",  "translations": { "en": "child",           "ru": "ребёнок" } },
    { "term": "acqua",    "translations": { "en": "water",           "ru": "вода" } },
    { "term": "casa",     "translations": { "en": "house, home",     "ru": "дом" } },
    { "term": "amico",    "translations": { "en": "friend",          "ru": "друг" } },
    { "term": "lavoro",   "translations": { "en": "work",            "ru": "работа" } },
    { "term": "mondo",    "translations": { "en": "world",           "ru": "мир" } },
    { "term": "vita",     "translations": { "en": "life",            "ru": "жизнь" } },
    { "term": "mano",     "translations": { "en": "hand",            "ru": "рука" } },
    { "term": "anno",     "translations": { "en": "year",            "ru": "год" } },
    { "term": "grande",   "translations": { "en": "big, large",      "ru": "большой" } },
    { "term": "piccolo",  "translations": { "en": "small",           "ru": "маленький" } },
    { "term": "buono",    "translations": { "en": "good",            "ru": "хороший" } },
    { "term": "bello",    "translations": { "en": "beautiful, nice", "ru": "красивый" } },
    { "term": "nuovo",    "translations": { "en": "new",             "ru": "новый" } },
    { "term": "giovane",  "translations": { "en": "young",           "ru": "молодой" } },
    { "term": "bene",     "translations": { "en": "well",            "ru": "хорошо" } },
    { "term": "sempre",   "translations": { "en": "always",          "ru": "всегда" } },
    { "term": "molto",    "translations": { "en": "much, very",      "ru": "много, очень" } },
    { "term": "adesso",   "translations": { "en": "now",             "ru": "сейчас" } },
    { "term": "oggi",     "translations": { "en": "today",           "ru": "сегодня" } }
  ]
}
