{
  "id": "de-top40-words",
  "language": "de",
  "name": "40 most frequent German words",
  "description": "40 high-frequency German words across common verbs, nouns, adjectives and adverbs, chosen for everyday usefulness rather than raw corpus rank. Nouns are shown with their capitalised spelling.",
  "items": [
    { "term": "sein",     "translations": { "en": "to be",           "ru": "быть" } },
    { "term": "haben",    "translations": { "en": "to have",         "ru": "иметь" } },
    { "term": "werden",   "translations": { "en": "to become",       "ru": "становиться" } },
    { "term": "können",   "translations": { "en": "can, to be able", "ru": "мочь, уметь" } },
    { "term": "müssen",   "translations": { "en": "must, to have to","ru": "быть должным" } },
    { "term": "sagen",    "translations": { "en": "to say",          "ru": "говорить, сказать" } },
    { "term": "machen",   "translations": { "en": "to do, to make",  "ru": "делать" } },
    { "term": "geben",    "translations": { "en": "to give",         "ru": "давать" } },
    { "term": "kommen",   "translations": { "en": "to come",         "ru": "приходить" } },
    { "term": "gehen",    "translations": { "en": "to go",           "ru": "идти" } },
    { "term": "wissen",   "translations": { "en": "to know",         "ru": "знать" } },
    { "term": "sehen",    "translations": { "en": "to see",          "ru": "видеть" } },
    { "term": "wollen",   "translations": { "en": "to want",         "ru": "хотеть" } },
    { "term": "finden",   "translations": { "en": "to find",         "ru": "находить" } },
    { "term": "denken",   "translations": { "en": "to think",        "ru": "думать" } },
    { "term": "nehmen",   "translations": { "en": "to take",         "ru": "брать" } },
    { "term": "Zeit",     "translations": { "en": "time",            "ru": "время" } },
    { "term": "Tag",      "translations": { "en": "day",             "ru": "день" } },
    { "term": "Mann",     "translations": { "en": "man",             "ru": "мужчина" } },
    { "term": "Frau",     "translations": { "en": "woman",           "ru": "женщина" } },
    { "term": "Kind",     "translations": { "en": "child",           "ru": "ребёнок" } },
    { "term": "Wasser",   "translations": { "en": "water",           "ru": "вода" } },
    { "term": "Haus",     "translations": { "en": "house",           "ru": "дом" } },
    { "term": "Freund",   "translations": { "en": "friend",          "ru": "друг" } },
    { "term": "Arbeit",   "translations": { "en": "work",            "ru": "работа" } },
    { "term": "Welt",     "translations": { "en": "world",           "ru": "мир" } },
    { "term": "Leben",    "translations": { "en": "life",            "ru": "жизнь" } },
    { "term": "Hand",     "translations": { "en": "hand",            "ru": "рука" } },
    { "term": "Jahr",     "translations": { "en": "year",            "ru": "год" } },
    { "term": "groß",     "translations": { "en": "big, tall",       "ru": "большой" } },
    { "term": "klein",    "translations": { "en": "small",           "ru": "маленький" } },
    { "term": "gut",      "translations": { "en": "good",            "ru": "хороший" } },
    { "term": "schön",    "translations": { "en": "beautiful, nice", "ru": "красивый" } },
    { "term": "neu",      "translations": { "en": "new",             "ru": "новый" } },
    { "term": "jung",     "translations": { "en": "young",           "ru": "молодой" } },
    { "term": "immer",    "translations": { "en": "always",          "ru": "всегда" } },
    { "term": "viel",     "translations": { "en": "much, many",      "ru": "много" } },
    { "term": "jetzt",    "translations": { "en": "now",             "ru": "сейчас" } },
    { "term": "heute",    "translations": { "en": "today",           "ru": "сегодня" } },
    { "term": "hier",     "translations": { "en": "here",            "ru": "здесь" } }
  ]
}
