{
  "id": "fr-top40-words",
  "language": "fr",
  "name": "40 most frequent French words",
  "description": "40 high-frequency French words across common verbs, nouns, adjectives and adverbs, chosen for everyday usefulness rather than raw corpus rank.",
  "items": [
    { "term": "être",        "translations": { "en": "to be",            "ru": "быть" } },
    { "term": "avoir",       "translations": { "en": "to have",          "ru": "иметь" } },
    { "term": "faire",       "translations": { "en": "to do, to make",   "ru": "делать" } },
    { "term": "dire",        "translations": { "en": "to say",           "ru": "говорить, сказать" } },
    { "term": "aller",       "translations": { "en": "to go",            "ru": "идти, ехать" } },
    { "term": "voir",        "translations": { "en": "to see",           "ru": "видеть" } },
    { "term": "savoir",      "translations": { "en": "to know",          "ru": "знать" } },
    { "term": "pouvoir",     "translations": { "en": "to be able to",    "ru": "мочь" } },
    { "term": "vouloir",     "translations": { "en": "to want",          "ru": "хотеть" } },
    { "term": "venir",       "translations": { "en": "to come",          "ru": "приходить" } },
    { "term": "devoir",      "translations": { "en": "to have to",       "ru": "быть должным" } },
    { "term": "prendre",     "translations": { "en": "to take",          "ru": "брать" } },
    { "term": "trouver",     "translations": { "en": "to find",          "ru": "находить" } },
    { "term": "donner",      "translations": { "en": "to give",          "ru": "давать" } },
    { "term": "parler",      "translations": { "en": "to speak",         "ru": "говорить" } },
    { "term": "aimer",       "translations": { "en": "to love, to like", "ru": "любить, нравиться" } },
    { "term": "penser",      "translations": { "en": "to think",         "ru": "думать" } },
    { "term": "temps",       "translations": { "en": "time, weather",    "ru": "время, погода" } },
    { "term": "jour",        "translations": { "en": "day",              "ru": "день" } },
    { "term": "homme",       "translations": { "en": "man",              "ru": "мужчина, человек" } },
    { "term": "femme",       "translations": { "en": "woman",            "ru": "женщина" } },
    { "term": "enfant",      "translations": { "en": "child",            "ru": "ребёнок" } },
    { "term": "eau",         "translations": { "en": "water",            "ru": "вода" } },
    { "term": "maison",      "translations": { "en": "house",            "ru": "дом" } },
    { "term": "ami",         "translations": { "en": "friend",           "ru": "друг" } },
    { "term": "travail",     "translations": { "en": "work",             "ru": "работа" } },
    { "term": "monde",       "translations": { "en": "world",            "ru": "мир" } },
    { "term": "vie",         "translations": { "en": "life",             "ru": "жизнь" } },
    { "term": "main",        "translations": { "en": "hand",             "ru": "рука" } },
    { "term": "année",       "translations": { "en": "year",             "ru": "год" } },
    { "term": "grand",       "translations": { "en": "big, tall",        "ru": "большой" } },
    { "term": "petit",       "translations": { "en": "small",            "ru": "маленький" } },
    { "term": "bon",         "translations": { "en": "good",             "ru": "хороший" } },
    { "term": "beau",        "translations": { "en": "beautiful",        "ru": "красивый" } },
    { "term": "nouveau",     "translations": { "en": "new",              "ru": "новый" } },
    { "term": "jeune",       "translations": { "en": "young",            "ru": "молодой" } },
    { "term": "bien",        "translations": { "en": "well",             "ru": "хорошо" } },
    { "term": "toujours",    "translations": { "en": "always",           "ru": "всегда" } },
    { "term": "beaucoup",    "translations": { "en": "a lot, much",      "ru": "много" } },
    { "term": "maintenant",  "translations": { "en": "now",              "ru": "сейчас" } }
  ]
}
