{
  "id": "pt-top40-words",
  "language": "pt",
  "name": "40 most frequent Portuguese words",
  "description": "40 high-frequency Portuguese words across common verbs, nouns, adjectives and adverbs, chosen for everyday usefulness rather than raw corpus rank.",
  "items": [
    { "term": "ser",       "translations": { "en": "to be (permanent)",  "ru": "быть (постоянно)" } },
    { "term": "estar",     "translations": { "en": "to be (state)",      "ru": "быть (состояние)" } },
    { "term": "ter",       "translations": { "en": "to have",            "ru": "иметь" } },
    { "term": "fazer",     "translations": { "en": "to do, to make",     "ru": "делать" } },
    { "term": "dizer",     "translations": { "en": "to say",             "ru": "говорить, сказать" } },
    { "term": "ir",        "translations": { "en": "to go",              "ru": "идти, ехать" } },
    { "term": "ver",       "translations": { "en": "to see",             "ru": "видеть" } },
    { "term": "saber",     "translations": { "en": "to know",            "ru": "знать" } },
    { "term": "poder",     "translations": { "en": "to be able to",      "ru": "мочь" } },
    { "term": "querer",    "translations": { "en": "to want",            "ru": "хотеть" } },
    { "term": "vir",       "translations": { "en": "to come",            "ru": "приходить" } },
    { "term": "dever",     "translations": { "en": "to have to",         "ru": "быть должным" } },
    { "term": "pegar",     "translations": { "en": "to take, to grab",   "ru": "брать" } },
    { "term": "encontrar", "translations": { "en": "to find",            "ru": "находить" } },
    { "term": "dar",       "translations": { "en": "to give",            "ru": "давать" } },
    { "term": "falar",     "translations": { "en": "to speak",           "ru": "говорить" } },
    { "term": "pensar",    "translations": { "en": "to think",           "ru": "думать" } },
    { "term": "tempo",     "translations": { "en": "time, weather",      "ru": "время, погода" } },
    { "term": "dia",       "translations": { "en": "day",                "ru": "день" } },
    { "term": "homem",     "translations": { "en": "man",                "ru": "мужчина, человек" } },
    { "term": "mulher",    "translations": { "en": "woman",              "ru": "женщина" } },
    { "term": "criança",   "translations": { "en": "child",              "ru": "ребёнок" } },
    { "term": "água",      "translations": { "en": "water",              "ru": "вода" } },
    { "term": "casa",      "translations": { "en": "house, home",        "ru": "дом" } },
    { "term": "amigo",     "translations": { "en": "friend",             "ru": "друг" } },
    { "term": "trabalho",  "translations": { "en": "work",               "ru": "работа" } },
    { "term": "mundo",     "translations": { "en": "world",              "ru": "мир" } },
    { "term": "vida",      "translations": { "en": "life",               "ru": "жизнь" } },
    { "term": "mão",       "translations": { "en": "hand",               "ru": "рука" } },
    { "term": "ano",       "translations": { "en": "year",               "ru": "год" } },
    { "term": "grande",    "translations": { "en": "big, large",         "ru": "большой" } },
    { "term": "pequeno",   "translations": { "en": "small",              "ru": "маленький" } },
    { "term": "bom",       "translations": { "en": "good",               "ru": "хороший" } },
    { "term": "novo",      "translations": { "en": "new",                "ru": "новый" } },
    { "term": "jovem",     "translations": { "en": "young",              "ru": "молодой" } },
    { "term": "bem",       "translations": { "en": "well",               "ru": "хорошо" } },
    { "term": "sempre",    "translations": { "en": "always",             "ru": "всегда" } },
    { "term": "muito",     "translations": { "en": "much, very",         "ru": "много, очень" } },
    { "term": "agora",     "translations": { "en": "now",                "ru": "сейчас" } },
    { "term": "hoje",      "translations": { "en": "today",              "ru": "сегодня" } }
  ]
}
